{
  "schema_version": "1.0",
  "date_kst": "2026-08-12",
  "generated_at": "2026-08-12T07:04:00+09:00",
  "status": "complete",
  "warnings": [
    "GPT-5.6-Cyber의 95% 수치는 OpenAI의 내부 Advanced Cybersecurity Completion Rate로, 실제 안전성·취약점 발견 효과를 독립 검증한 결과가 아니다.",
    "Claude의 제타함수 결과는 논문과 sorry-free Lean 저장소가 공개됐지만 광범위한 동료평가는 진행 중이며 사용 모델도 아직 공개되지 않았다.",
    "Claude 워터마크의 제3자 탐지 도구와 오탐·편집·번역 내구성 세부치는 아직 공개되지 않았고 C2PA 메타데이터는 변환 과정에서 제거될 수 있다.",
    "River AI의 기업가치가 공개되지 않았고 15~20분 RL 실행 및 2~4배 비용 효율은 회사 주장으로 독립 재현되지 않았다.",
    "ChatGPT Linux 앱은 프리뷰이며 패키지 서명·자동 업데이트·장기 지원 정책을 설명하는 Linux 전용 공식 문서는 찾지 못했다."
  ],
  "news": [
    {
      "event_key": "2026-08-openai-gpt-5-6-cyber-daybreak-blue-red",
      "title": "OpenAI launches GPT-5.6-Cyber and splits Daybreak into Blue and Red access tiers",
      "importance": "S",
      "selection_score": 94,
      "score_breakdown": {"confidence": 29, "impact": 24, "utility": 20, "recency": 15, "community": 6},
      "one_line_summary": "OpenAI가 방어 작업용 Daybreak Blue와 고위험 승인 연구용 Red를 분리하고, 내부 평가에서 민감한 고급 사이버 요청의 95%를 완료한 GPT-5.6-Cyber를 Red에 배치했다.",
      "impact": "고성능 사이버 AI가 일반 공개 대신 신원·목적·감사 통제를 포함한 신뢰 접근 계층으로 제품화되면서 모델 성능과 접근 거버넌스가 하나의 구매 단위가 된다.",
      "original_url": "https://openai.com/index/expanding-daybreak-as-the-cyber-defense-window-narrows/",
      "key_quote": "GPT‑5.6‑Cyber completes 95.0% of these requests, compared with just 1.5% for GPT‑5.6 Sol.",
      "quote_translation": "GPT-5.6-Cyber는 이 요청의 95.0%를 완료했으며 GPT-5.6 Sol은 1.5%였다.",
      "summary": "FACT: OpenAI는 Daybreak를 Blue와 Red로 나누고 Red에 GPT-5.6-Cyber를 제공한다. Blue는 승인된 방어 작업에 GPT-5.6 Sol을, Red는 취약점 연구·익스플로잇 검증·보안 시험에 목적 훈련 모델을 제공한다. OpenAI 내부 평가는 GPT-5.6-Cyber가 인증 우회·권한 상승·익스플로잇 체인 요청의 95.0%를 완료했다고 보고했으며, 일반 Sol은 1.5%, Blue는 2.0%, GPT-5.5-Cyber는 57.3%였다. 파트너 프로그램은 고객이 아니라 승인된 제공자에게 모델 접근을 유지하고 범위·로깅·모니터링·사람 감독을 요구한다. TechCrunch와 Axios가 모델 출시와 제한 접근 구조를 독립 보도했다. INTERPRETATION: 고위험 능력은 모델 API보다 승인·감사·사고대응을 묶은 운영체계로 판매되기 시작했다. SIGNAL: 보안 AI 도입 계약에서 작업 권한, 로그 보존, 사용 목적과 즉시 차단 절차가 성능만큼 중요해진다. SPECULATION: 한국 보안팀에도 승인된 과업만 모델에 전달하고 증거를 남기는 중간 통제 계층 수요가 생길 수 있다.",
      "why_it_matters": "한국의 소규모 보안팀은 강한 모델을 직접 보유하기보다 승인된 파트너와 통제된 워크플로를 통해 접근할 가능성이 높아, 모델 선택보다 권한·증거·책임경계를 먼저 설계해야 한다.",
      "industry_mood": {"sentiment": "capability-impressed / access-cautious", "signal": "95% 완료율과 제로데이 역량에는 관심이 크지만 내부 평가와 높은 이중용도 위험 때문에 제한 접근이 타당하다는 분위기"},
      "outlook": "AI 추론: 사이버 특화 모델은 일반 SaaS 좌석보다 신원확인, 작업 승인, 실시간 감시, 결과 검토가 결합된 관리형 접근으로 확산될 가능성이 높다.",
      "business_opportunity": "승인 티켓·자산 범위·모델 호출·사람 검토·증거 로그를 하나의 실행 기록으로 묶는 보안 AI 워크플로 게이트웨이.",
      "tags": ["OpenAI", "GPT-5.6-Cyber", "Daybreak", "cybersecurity", "trusted-access", "governance"],
      "sources": [
        {"title": "Expanding Daybreak as the Cyber Defense Window Narrows", "url": "https://openai.com/index/expanding-daybreak-as-the-cyber-defense-window-narrows/", "publisher": "OpenAI", "published_at": "2026-08-10", "tier": "A"},
        {"title": "Putting frontier cyber models in more trusted hands", "url": "https://openai.com/index/putting-frontier-cyber-models-in-more-trusted-hands/", "publisher": "OpenAI", "published_at": "2026-08-10", "tier": "A"},
        {"title": "As AI-led attacks multiply, OpenAI launches a new cyber model", "url": "https://techcrunch.com/2026/08/10/as-ai-led-attacks-multiply-openai-launches-a-new-cyber-model/", "publisher": "TechCrunch", "published_at": "2026-08-10", "tier": "B"},
        {"title": "OpenAI's powerful hacking model comes with strict restrictions", "url": "https://www.axios.com/2026/08/10/openai-gpt-astra-restrictions-safety-hacking-defenders", "publisher": "Axios", "published_at": "2026-08-10", "tier": "B"}
      ]
    },
    {
      "event_key": "2026-08-anthropic-claude-riemann-zeta-two-thirds-lean",
      "title": "Anthropic releases a Claude-authored proof raising the verified zeta-zero lower bound to 67.2%",
      "importance": "S",
      "selection_score": 92,
      "score_breakdown": {"confidence": 28, "impact": 25, "utility": 18, "recency": 15, "community": 6},
      "one_line_summary": "Anthropic가 미공개 연구용 Claude가 리만 제타함수 임계선 위 영점의 무조건적 하한을 41.6%에서 67.2%로 높인 논문과 sorry-free Lean 증명을 공개했다.",
      "impact": "AI 수학 주장에 사람이 읽는 논문뿐 아니라 컴파일 가능한 형식 증명을 함께 배포한 사례로, 연구 성과의 평가 단위가 답변에서 재현 가능한 증거 묶음으로 이동한다.",
      "original_url": "https://www.anthropic.com/research/riemann-zeta",
      "key_quote": "It has increased this bound from 41.6% to 67.2%.",
      "quote_translation": "이 하한을 41.6%에서 67.2%로 높였다.",
      "summary": "FACT: Anthropic는 미공개 연구용 Claude가 리만 가설 자체를 풀지는 못했지만, 임계선 위에 있는 영점의 알려진 무조건적 비율을 41.6%에서 67.2%로 높였다고 발표했다. 논문은 2/3 이상을 증명하고 최적화값 0.6725를 제시한다. Anthropic 수학자 두 명과 Brian Conrey·Dan Goldston이 검토했으며, 공개 GitHub 저장소에는 Lean 4로 작성된 sorry-free 형식화와 표준 공리 점검 방법이 있다. TechCrunch가 결과와 리만 가설 미해결이라는 범위를 독립 보도했다. 다만 광범위한 동료평가는 아직 완료되지 않았다. INTERPRETATION: 프런티어 모델의 과학적 가치는 생성된 주장보다 검증 가능한 산출물과 인간 검토 과정으로 판단해야 한다. SIGNAL: 논문·코드·정리 명세·빌드 환경을 동시에 공개하는 artifact-first 연구 관행이 강화된다. SPECULATION: AI 연구 결과를 독립 재현하고 증거 사슬을 요약하는 전문 서비스가 소규모 연구팀에 유용할 수 있다.",
      "why_it_matters": "한국 연구팀과 기술 실사자는 ‘AI가 발견했다’는 헤드라인보다 정리의 정확한 범위, 선행연구, 형식 증명, 재현 환경과 사람 검토 상태를 함께 확인해야 한다.",
      "industry_mood": {"sentiment": "astonished / peer-review-cautious", "signal": "큰 수학적 도약과 Lean 산출물에는 강한 기대가 있지만 모델 미공개와 제한된 외부 검토를 분명히 구분하는 분위기"},
      "outlook": "AI 추론: 고난도 과학 발표에서 논문 PDF만 공개하는 것으로는 부족해지고, 고정된 코드·형식 증명·테스트·전문가 검토 기록이 신뢰의 기본 단위가 될 가능성이 높다.",
      "business_opportunity": "AI 생성 연구 주장의 정리 범위, 선행연구, 코드/증명 재현, 독립 검토 상태를 한 장의 검증 패킷으로 만드는 서비스.",
      "tags": ["Anthropic", "Claude", "Riemann-zeta", "mathematics", "Lean", "formal-verification"],
      "sources": [
        {"title": "Learning more about Claude's mathematical capabilities", "url": "https://www.anthropic.com/research/riemann-zeta", "publisher": "Anthropic", "published_at": "2026-08-10", "tier": "A"},
        {"title": "More Than Two Thirds of the Zeros of the Riemann Zeta Function Lie on the Critical Line", "url": "https://www-cdn.anthropic.com/564f962e60643842f5fcb4a17c9dbc8f608f1c37.pdf", "publisher": "Anthropic", "published_at": "2026-08-10", "tier": "A"},
        {"title": "anthropics/zeta-23-lean", "url": "https://github.com/anthropics/zeta-23-lean", "publisher": "Anthropic", "published_at": "2026-08-10", "tier": "A"},
        {"title": "An unreleased Anthropic model made progress on one of math's biggest unsolved problems", "url": "https://techcrunch.com/2026/08/11/an-unreleased-anthropic-model-made-progress-on-one-of-maths-biggest-unsolved-problems/", "publisher": "TechCrunch", "published_at": "2026-08-11", "tier": "B"}
      ]
    },
    {
      "event_key": "2026-08-anthropic-claude-watermark-c2pa",
      "title": "Anthropic commits Claude outputs to invisible text watermarks and signed C2PA provenance",
      "importance": "S",
      "selection_score": 90,
      "score_breakdown": {"confidence": 29, "impact": 22, "utility": 20, "recency": 15, "community": 4},
      "one_line_summary": "Anthropic가 새 Claude 모델의 텍스트에 비가시 워터마크를, 지원 파일에 서명된 C2PA 출처 메타데이터를 넣고 전 세계 제품·API·클라우드 경로로 확대하겠다고 밝혔다.",
      "impact": "AI 생성물 표시는 화면 배지에서 모델 출력과 파일 자체에 내장되는 기계 판독 가능한 증거로 이동해 게시·교육·기업 감사 워크플로에 직접 영향을 준다.",
      "original_url": "https://support.claude.com/en/articles/16266773-how-claude-marks-ai-generated-content",
      "key_quote": "Generated text will carry embedded watermarks, and generated files will include digitally signed provenance metadata where supported.",
      "quote_translation": "생성 텍스트에는 내장 워터마크가, 지원되는 생성 파일에는 디지털 서명된 출처 메타데이터가 포함된다.",
      "summary": "FACT: Anthropic 지원 문서는 2026년 8월 2일 이후 EU에서 출시되는 새 Claude 모델이 출시 시점부터 기계 판독 표시를 지원한다고 설명한다. 텍스트에는 보이지 않는 워터마크를, 지원 파일에는 서명된 C2PA 출처 메타데이터를 넣는다. 범위는 Claude, API, Claude Code, Cowork, Tag와 AWS·Google Cloud·Microsoft Foundry 경로를 포함하며 적용 지역은 전 세계다. 기존 모델 지원과 탐지 메커니즘은 준비 중이다. The Verge와 TechCrunch가 발표를 독립 보도했고, The Verge는 심한 편집과 메타데이터 제거 한계를 지적했다. C2PA는 공개 표준 사양을 제공한다. INTERPRETATION: 생성물 투명성은 공급자 약관이 아니라 후속 시스템이 검사할 수 있는 데이터 계층으로 이동한다. SIGNAL: 조직은 생성 여부뿐 아니라 편집·번역·내보내기 뒤 표시 보존 여부를 시험해야 한다. SPECULATION: 한국 콘텐츠·교육·마케팅팀을 위한 워터마크/C2PA 보존성 QA가 짧은 주기의 유료 검증 서비스가 될 수 있다.",
      "why_it_matters": "표시가 전 세계 API와 업무도구까지 적용되면 한국 조직도 AI 보조 편집, 파일 변환, SNS 업로드 과정에서 provenance가 유지되는지와 오탐 대응 절차를 준비해야 한다.",
      "industry_mood": {"sentiment": "transparency-positive / robustness-skeptical", "signal": "출처 표시 원칙에는 동의가 많지만 편집 내구성, 오탐, 코드 출력과 제거 가능성에 대한 질문이 집중됨"},
      "outlook": "AI 추론: 플랫폼은 AI 표식을 단순 탐지 점수보다 서명 검증, 변환 이력, 사용 정책과 결합하고 조직은 채널별 보존성 시험을 정기 감사 항목으로 만들 가능성이 높다.",
      "business_opportunity": "Claude/API/문서도구/SNS 변환 경로별로 텍스트 워터마크와 C2PA 서명이 유지되는지 검증하고 증거 로그를 내보내는 한국어 QA 키트.",
      "tags": ["Anthropic", "Claude", "watermark", "C2PA", "provenance", "EU-AI-Act"],
      "sources": [
        {"title": "How Claude marks AI-generated content", "url": "https://support.claude.com/en/articles/16266773-how-claude-marks-ai-generated-content", "publisher": "Anthropic", "published_at": "2026-08-10", "tier": "A"},
        {"title": "C2PA Technical Specification 2.4", "url": "https://spec.c2pa.org/specifications/specifications/2.4/specs/C2PA_Specification.html", "publisher": "C2PA", "published_at": "2026", "tier": "A"},
        {"title": "Claude will apply invisible watermarks to AI text and images", "url": "https://www.theverge.com/ai-artificial-intelligence/977823/anthropic-claude-ai-watermarks-c2pa-text-images", "publisher": "The Verge", "published_at": "2026-08-11", "tier": "B"},
        {"title": "Anthropic says it will watermark text generated by its AI models", "url": "https://techcrunch.com/2026/08/11/anthropic-says-it-will-watermark-text-generated-by-its-ai-models/", "publisher": "TechCrunch", "published_at": "2026-08-11", "tier": "B"}
      ]
    },
    {
      "event_key": "2026-08-river-ai-1-1b-seed-series-a",
      "title": "River AI raises $1.1B to build customizable, user-owned open-weight models",
      "importance": "A",
      "selection_score": 88,